{
  "schema_version": 1,
  "suite": "portable-verification",
  "producer": {
    "project": "subject",
    "revision": "fixture-v1",
    "map_input_sha256": "4aa724f2bdd4e30a48fcf87999a761350e848d8ae39bf25d9d28c4724a0c6d9d",
    "evidence": [
      {
        "role": "runner",
        "path": "runner.py",
        "sha256": "9ed3f36433844550ee1987b33a7408b98a3c37541b54787153a03d75eb61cead"
      },
      {
        "role": "case_bundle",
        "path": "cases.json",
        "sha256": "712273728106f22cf6858045591be230cf227ecf35790eb505e6022e4a7dda98"
      },
      {
        "role": "subject",
        "path": "src/core.c",
        "sha256": "53dbe0569ab271aa3762036acf24403e2f289447fe5f119fbcfe812e0fdefbaa"
      },
      {
        "role": "subject",
        "path": "src/core.h",
        "sha256": "9b03e124e11d634dddc9225b44b17e41ea98b9ee1e59036c0750696af8fc2317"
      }
    ],
    "evidence_slice_sha256": "a5cbd72f3a214d98f1d74c4efc59898d989eee2612fb48c903492e8cdf0d0f11"
  },
  "profile": {
    "id": "cpu-int32",
    "capabilities": ["shape"],
    "parameters": {"rank_limit": 8}
  },
  "cases": [
    {
      "id": "permute.valid",
      "requirements": ["SHAPE-001"],
      "input": {"shape": [2, 3], "axes": [1, 0]},
      "requires": ["shape"],
      "requires_parameters": {"rank_limit": 8},
      "comparison": {"kind": "exact"},
      "observations": [
        {
          "route": "python",
          "outcome": {
            "phase": "runtime",
            "kind": "ok",
            "value": {"shape": [3, 2]}
          }
        },
        {
          "route": "browser",
          "outcome": {
            "phase": "runtime",
            "kind": "ok",
            "value": {"shape": [2, 3]}
          }
        }
      ]
    },
    {
      "id": "permute.invalid",
      "requirements": ["SHAPE-001"],
      "input": {"shape": [2, 3], "axes": [0, 0]},
      "requires": ["shape"],
      "comparison": {"kind": "exact"},
      "observations": [
        {
          "route": "python",
          "outcome": {
            "phase": "validation",
            "kind": "rejected",
            "type": "invalid-permutation"
          }
        }
      ]
    },
    {
      "id": "reduce.float",
      "requirements": ["NUMERIC-001"],
      "input": {"values": [0.1, 0.2]},
      "comparison": {"kind": "float", "atol": 1e-9, "rtol": 1e-9, "max_ulp": 1000000, "nan_equal": true, "signed_zero_equal": false},
      "observations": [
        {
          "route": "python",
          "outcome": {
            "phase": "runtime",
            "kind": "ok",
            "value": 0.30000000001
          }
        },
        {
          "route": "browser",
          "outcome": {
            "phase": "runtime",
            "kind": "ok",
            "value": 0.30000000001
          }
        }
      ]
    }
  ]
}
